<?xml version="1.0" encoding="UTF-8"?>
<tns:sharding-client-config
	xmlns:tns="http://www.talentica.com/hungryhippos/config/sharding"
	xmlns:xsi="http://www.w3.org/2001/XMLSchema-instance"
	xsi:schemaLocation="http://www.talentica.com/hungryhippos/config/sharding sharding-client-config.xsd ">
	<tns:input>
<tns:sample-file-path>/home/sudarshans/data_spark_char.csv</tns:sample-file-path>
<tns:distributed-file-path>/sudarshans/100lines</tns:distributed-file-path>
		<tns:data-description>
			<tns:column>
				<tns:name>key1</tns:name>
				<tns:data-type>STRING</tns:data-type>
				<tns:size>1</tns:size>
			</tns:column>
			<tns:column>
				<tns:name>key2</tns:name>
				<tns:data-type>LONG</tns:data-type>
				<tns:size>0</tns:size>
			</tns:column>
			
		</tns:data-description>
		<tns:data-parser-config>
			<tns:class-name>com.talentica.hungryHippos.client.data.parser.CsvDataParser</tns:class-name>
<tns:jar-file-path>/root/hungryhippos_chefsolo_vagrant_modularise/test-jobs.jar</tns:jar-file-path>
		</tns:data-parser-config>
	</tns:input>
	<tns:sharding-dimensions>key1</tns:sharding-dimensions>
	<tns:maximum-size-of-single-block-data>80</tns:maximum-size-of-single-block-data>
  <tns:bad-records-file-out>/home/sudarshans/bad_rec.err</tns:bad-records-file-out>
  <tns:data-file-sorting>true</tns:data-file-sorting>
</tns:sharding-client-config>
