<?xml version="1.0" encoding="UTF-8"?>
<tns:sharding-client-config
	xmlns:tns="http://www.talentica.com/hungryhippos/config/sharding"
	xmlns:xsi="http://www.w3.org/2001/XMLSchema-instance"
	xsi:schemaLocation="http://www.talentica.com/hungryhippos/config/sharding sharding-client-config.xsd ">
	<tns:input>
		<tns:sample-file-path>/home/pooshans/HungryHippos/HungryHippos/utility/sampledata.csv</tns:sample-file-path>
		<tns:distributed-file-path>/pooshan/dir/input</tns:distributed-file-path>
		<tns:data-description>
			<tns:column>
				<tns:name>key1</tns:name>
				<tns:data-type>STRING</tns:data-type>
				<tns:size>1</tns:size>
			</tns:column>
			<tns:column>
				<tns:name>key2</tns:name>
				<tns:data-type>STRING</tns:data-type>
				<tns:size>1</tns:size>
			</tns:column>
			<tns:column>
				<tns:name>key3</tns:name>
				<tns:data-type>STRING</tns:data-type>
				<tns:size>1</tns:size>
			</tns:column>
			<tns:column>
				<tns:name>key4</tns:name>
				<tns:data-type>STRING</tns:data-type>
				<tns:size>3</tns:size>
			</tns:column>
			<tns:column>
				<tns:name>key5</tns:name>
				<tns:data-type>STRING</tns:data-type>
				<tns:size>3</tns:size>
			</tns:column>
			<tns:column>
				<tns:name>key6</tns:name>
				<tns:data-type>STRING</tns:data-type>
				<tns:size>3</tns:size>
			</tns:column>
			<tns:column>
				<tns:name>key7</tns:name>
				<tns:data-type>DOUBLE</tns:data-type>
				<tns:size>0</tns:size>
			</tns:column>
			<tns:column>
				<tns:name>key8</tns:name>
				<tns:data-type>DOUBLE</tns:data-type>
				<tns:size>0</tns:size>
			</tns:column>
			<tns:column>
				<tns:name>key9</tns:name>
				<tns:data-type>STRING</tns:data-type>
				<tns:size>5</tns:size>
			</tns:column>
		</tns:data-description>
		<tns:data-parser-config>
			<tns:class-name>com.talentica.hungryHippos.client.data.parser.CsvDataParser</tns:class-name>
			<tns:jar-file-path>/home/pooshans/HungryHippos/HungryHippos/test-hungry-hippos/build/libs/test-jobs.jar</tns:jar-file-path>
		</tns:data-parser-config>
	</tns:input>
	<tns:sharding-dimensions>key1,key2,key3</tns:sharding-dimensions>
	<tns:maximum-size-of-single-block-data>80</tns:maximum-size-of-single-block-data>
</tns:sharding-client-config>